{
  "audit_id": "AUDIT-GPT-PHASE2-B-REALISM-2026-08-13",
  "auditor": "GPT",
  "audit_date": "2026-08-13",
  "audit_scope": "REAUDIT",
  "review_type": "REALISM_REVIEW",
  "independent": true,
  "audit_status": "FULLY_ADJUDICATED",
  "style_profile": {
    "profile_id": "MPJE-MA-PRE2027",
    "content_version": 1,
    "content_hash": "293be8fdcd39af2255a22a0423b7123d5cfcf7c0e6c561872eb0ef04e745015c"
  },
  "question_ids": [
    "MA-Q-0051",
    "MA-Q-0052",
    "MA-Q-0053",
    "MA-Q-0054",
    "MA-Q-0055",
    "MA-Q-0056",
    "MA-Q-0057",
    "MA-Q-0058",
    "MA-Q-0059",
    "MA-Q-0060",
    "MA-Q-0061",
    "MA-Q-0062",
    "MA-Q-0063",
    "MA-Q-0064",
    "MA-Q-0065",
    "MA-Q-0066",
    "MA-Q-0067",
    "MA-Q-0068",
    "MA-Q-0069",
    "MA-Q-0070",
    "MA-Q-0071",
    "MA-Q-0072",
    "MA-Q-0073",
    "MA-Q-0074",
    "MA-Q-0075",
    "MA-Q-0076",
    "MA-Q-0077",
    "MA-Q-0078",
    "MA-Q-0079",
    "MA-Q-0080",
    "MA-Q-0081",
    "MA-Q-0082",
    "MA-Q-0083",
    "MA-Q-0084",
    "MA-Q-0085",
    "MA-Q-0086",
    "MA-Q-0087",
    "MA-Q-0088",
    "MA-Q-0089",
    "MA-Q-0090"
  ],
  "question_hashes": {
    "MA-Q-0051": "bda8b80a0f41674ce51f748a5371410e942666696d309e5d3ff26f3a51a27e7b",
    "MA-Q-0052": "c58759ef9978338f643674bd1b00d1be6b606d2f6fc678a50e2f9125623e59df",
    "MA-Q-0053": "633c6a04c65561853a4326a8b34b47d34cf071ad4003189e201165d3ba7e340f",
    "MA-Q-0054": "be28378826330dd595b2494ff7575ee763a237f73a22a576ddebe53b57ea2b7e",
    "MA-Q-0055": "689f23dfa0deb82576de87eac124cad916aca171e64be32a05a55bf0642036c6",
    "MA-Q-0056": "32d86864addbfad2411d46f57c8a2903e1f85681601af6acf0b1dab673bf24e6",
    "MA-Q-0057": "f14e31cc1743506e0a71b947b8f3a292b65dc97972390c441d60554cd1b3779b",
    "MA-Q-0058": "ca0b03cef8bcca2400820ec9b8c3b6b956718100439c45e0ce045b61748778ab",
    "MA-Q-0059": "70532b0a541b4e6e770402a0be07e40aa22b5c2f8812ee150619b5f20ba6cdb3",
    "MA-Q-0060": "fa78d8ed09ab0980614cacfb3d9854362d5080424478d8b33940d9ef1af0b8ed",
    "MA-Q-0061": "60aea55b0f2a4ee866ae1a50b0e460ca17fa31bd5b57fecee295bd16c3902b0f",
    "MA-Q-0062": "d689835851608165324d2104a19bd1f7fbbc0e1100241b3ffcf3dafa2f839fe1",
    "MA-Q-0063": "433202999a11a9b0785685c334bbf8200ac04cb59db01db35a1f7ca24b6fa223",
    "MA-Q-0064": "2a6a9cb3f28c4c623f18f2b512badb3d492bda0f3f9efae7ede84844aa53685b",
    "MA-Q-0065": "401c6b64a7f423bf5cf296fe7881d33a42f061ce7f145acdb9fc184207dfdbe9",
    "MA-Q-0066": "1a919b3da44a0cc0388d30825c10f542c5063c1d8cad7d85236f3cf917fcc19f",
    "MA-Q-0067": "e42850c154499c08026754833b0b9a492d62d4654752e815d2326e47ff384617",
    "MA-Q-0068": "c77a04aca58073a061371134ed4cdda2c479ab62b162b951f16962d16ff81318",
    "MA-Q-0069": "74cd1d1b237eff1bd95a565c546cd3d99b1feae675907e99b2ad7e69761183d2",
    "MA-Q-0070": "42edae2a0754373d524b358db781e15b78cb01ca1df6f9d8731add866e82605c",
    "MA-Q-0071": "6e054a5c5f3cafc123ea52510b42ed40c3d3c56a87540acbe4ba73c35bcdb246",
    "MA-Q-0072": "51f062e9d68a1c0822ff2b1d1fb13a4b5eab9e2c0bed1a2e8a9526f77427f01e",
    "MA-Q-0073": "6d7b09510621e0a97321ae374ce2cd0ed6e97f98c816d3bfedb934a1e9c57983",
    "MA-Q-0074": "6c12269bd2c020342ebc8c07fed173aa61f814dea59f679906b9820b41d3a30b",
    "MA-Q-0075": "902002f1850729bf5986dcf0b647fadf2e0fd102bb480889a096f7b06fa224d6",
    "MA-Q-0076": "c874c0c6818cf8b71a769e2e424def1b9ff5532eedca36f9ce977eb70966e52a",
    "MA-Q-0077": "69fe1149b6aa53d711f2b8ab9da397c1f0051036b09012596591529fa8624806",
    "MA-Q-0078": "be019bc7bdf3d99016c3448e318b73f1e820f67078949625b61407750cecaf6d",
    "MA-Q-0079": "b44ca08ca8b6bc298556ee3cfeccf0109089fdca2f689b65e428f92943833633",
    "MA-Q-0080": "4643877f95f39efd1ba8f89c2a97ef10da478e9f4e5dc0c25b8b710cc6b1e009",
    "MA-Q-0081": "7faecb547bf60a2ae9af13a9e12126e7cfe6fd674ee71bb2fe6e5c093a7084d2",
    "MA-Q-0082": "ee11e110e3835c68c13f8f5634495d1306b2139a9f266eba981eaa2682f91ceb",
    "MA-Q-0083": "57135369569dd9161f9d37ac67bad220cd3c8a3c5ab3cfa2429ca360ae5b89e6",
    "MA-Q-0084": "871d452354cba346c6c6332fa551e1d46af6d3e6736e8facdb1744ea54a268d9",
    "MA-Q-0085": "54a683f911649020c066cec95c64e3fb6715011eccbcd57ac20c77adb1d043d6",
    "MA-Q-0086": "05d7782ef035cfdb4641b9f4cffa037706055326a3bc3431f9733b577b0bad40",
    "MA-Q-0087": "2b9e536f22edd726b8c99d7a53371764987612b6f17574e49d496cbd0ed594c9",
    "MA-Q-0088": "4a94952c3b6bfed1bacfdc79e0a5fd956b36650f78acdd011b7a89ee498265eb",
    "MA-Q-0089": "a94ca941776808fdb20973bc3f9d364a5be70652f6b217cda5ca41b4fbfb0046",
    "MA-Q-0090": "a07d88fa2475926a112fcd985a03472b9acfb31db92281aa2726984a6d8f9960"
  },
  "results": [
    {
      "Question_ID": "MA-Q-0051",
      "Verdict": "KEEP",
      "Severity": "Low",
      "Realism_Verdict": "PASS",
      "Reviewed_Date": "2026-08-13",
      "Criteria": {
        "jurisprudence_reasoning": true,
        "practice_plausibility": true,
        "authentic_distractors": true,
        "wording_not_guessable": true,
        "reasoning_not_trivia": true,
        "natural_rule_combination": true,
        "appropriate_drug_context": true,
        "distinct_from_bank": true,
        "not_schedule_flashcard": true,
        "public_style_without_copying": true
      },
      "Notes": "MA-CQI-PROGRAM의 trigger를 pharmacy decision에 적용하게 하며, 공식 public MPJE sample의 selected-response 구조와 양립한다. material ambiguity나 bank-level wording leakage를 확인하지 못했다."
    },
    {
      "Question_ID": "MA-Q-0052",
      "Verdict": "MINOR_EDIT",
      "Severity": "Medium",
      "Realism_Verdict": "FAIL",
      "Reviewed_Date": "2026-08-13",
      "Criteria": {
        "jurisprudence_reasoning": true,
        "practice_plausibility": true,
        "authentic_distractors": false,
        "wording_not_guessable": false,
        "reasoning_not_trivia": true,
        "natural_rule_combination": true,
        "appropriate_drug_context": true,
        "distinct_from_bank": false,
        "not_schedule_flashcard": true,
        "public_style_without_copying": false
      },
      "Notes": "distractor에 반복 삽입된 'if its alternate trigger can be documented' 또는 'after documenting whether ...' 문구가 문법과 meaning을 훼손하고 generator template을 노출한다. core legal scenario는 살릴 수 있으나 distractor를 자연스러운 competing rule로 다시 써야 한다."
    },
    {
      "Question_ID": "MA-Q-0053",
      "Verdict": "KEEP",
      "Severity": "Low",
      "Realism_Verdict": "PASS",
      "Reviewed_Date": "2026-08-13",
      "Criteria": {
        "jurisprudence_reasoning": true,
        "practice_plausibility": true,
        "authentic_distractors": true,
        "wording_not_guessable": true,
        "reasoning_not_trivia": true,
        "natural_rule_combination": true,
        "appropriate_drug_context": true,
        "distinct_from_bank": true,
        "not_schedule_flashcard": true,
        "public_style_without_copying": true
      },
      "Notes": "MA-QRE-DOCUMENT-24H의 trigger를 pharmacy decision에 적용하게 하며, 공식 public MPJE sample의 selected-response 구조와 양립한다. material ambiguity나 bank-level wording leakage를 확인하지 못했다."
    },
    {
      "Question_ID": "MA-Q-0054",
      "Verdict": "MINOR_EDIT",
      "Severity": "Medium",
      "Realism_Verdict": "FAIL",
      "Reviewed_Date": "2026-08-13",
      "Criteria": {
        "jurisprudence_reasoning": true,
        "practice_plausibility": true,
        "authentic_distractors": false,
        "wording_not_guessable": false,
        "reasoning_not_trivia": true,
        "natural_rule_combination": true,
        "appropriate_drug_context": true,
        "distinct_from_bank": false,
        "not_schedule_flashcard": true,
        "public_style_without_copying": false
      },
      "Notes": "distractor에 반복 삽입된 'if its alternate trigger can be documented' 또는 'after documenting whether ...' 문구가 문법과 meaning을 훼손하고 generator template을 노출한다. core legal scenario는 살릴 수 있으나 distractor를 자연스러운 competing rule로 다시 써야 한다."
    },
    {
      "Question_ID": "MA-Q-0055",
      "Verdict": "KEEP",
      "Severity": "Low",
      "Realism_Verdict": "PASS",
      "Reviewed_Date": "2026-08-13",
      "Criteria": {
        "jurisprudence_reasoning": true,
        "practice_plausibility": true,
        "authentic_distractors": true,
        "wording_not_guessable": true,
        "reasoning_not_trivia": true,
        "natural_rule_combination": true,
        "appropriate_drug_context": true,
        "distinct_from_bank": true,
        "not_schedule_flashcard": true,
        "public_style_without_copying": true
      },
      "Notes": "MA-QRE-ANNUAL-ED의 trigger를 pharmacy decision에 적용하게 하며, 공식 public MPJE sample의 selected-response 구조와 양립한다. material ambiguity나 bank-level wording leakage를 확인하지 못했다."
    },
    {
      "Question_ID": "MA-Q-0056",
      "Verdict": "KEEP",
      "Severity": "Low",
      "Realism_Verdict": "PASS",
      "Reviewed_Date": "2026-08-13",
      "Criteria": {
        "jurisprudence_reasoning": true,
        "practice_plausibility": true,
        "authentic_distractors": true,
        "wording_not_guessable": true,
        "reasoning_not_trivia": true,
        "natural_rule_combination": true,
        "appropriate_drug_context": true,
        "distinct_from_bank": true,
        "not_schedule_flashcard": true,
        "public_style_without_copying": true
      },
      "Notes": "MA-SERIOUS-EVENT-REPORT의 trigger를 pharmacy decision에 적용하게 하며, 공식 public MPJE sample의 selected-response 구조와 양립한다. material ambiguity나 bank-level wording leakage를 확인하지 못했다."
    },
    {
      "Question_ID": "MA-Q-0057",
      "Verdict": "KEEP",
      "Severity": "Low",
      "Realism_Verdict": "PASS",
      "Reviewed_Date": "2026-08-13",
      "Criteria": {
        "jurisprudence_reasoning": true,
        "practice_plausibility": true,
        "authentic_distractors": true,
        "wording_not_guessable": true,
        "reasoning_not_trivia": true,
        "natural_rule_combination": true,
        "appropriate_drug_context": true,
        "distinct_from_bank": true,
        "not_schedule_flashcard": true,
        "public_style_without_copying": true
      },